{
  "version": 2,
  "generated_at": "2026-10-07T12:00:00Z",
  "repo": "moooncang/game",
  "employees": {
    "gpt": {
      "name": "GPT",
      "state": "coding",
      "message": "5-2 피드백 반영 중 (바닥 색)",
      "task": 5,
      "updated_at": "2026-10-07T11:58:00Z",
      "open_feedback": 1
    },
    "claude": {
      "name": "Claude",
      "state": "offline",
      "message": "검수 완료, 퇴근",
      "task": null,
      "updated_at": "2026-10-07T10:20:00Z",
      "open_feedback": 0
    }
  },
  "tasks": [
    {
      "number": 5,
      "title": "사무실 도트 디테일과 색감 개선",
      "assignee": "gpt",
      "state": "open",
      "url": "https://github.com/moooncang/game/issues/5"
    },
    {
      "number": 2,
      "title": "홈페이지를 회사 운영 도트 게임 화면으로 개편",
      "assignee": "gpt",
      "state": "closed",
      "url": "https://github.com/moooncang/game/issues/2"
    }
  ],
  "reports": [
    {
      "id": 2000000007,
      "doc": "5-5",
      "task": 5,
      "author": "gpt",
      "branch": "화면 구성",
      "kind": "작업보고",
      "title": "책장 위치 이동 (5-1 반려 반영)",
      "pr": 9,
      "answers": [
        "5-1"
      ],
      "body_md": "## 한 일\n- 책장을 오른쪽 벽으로 옮겨 출구 확보",
      "created_at": "2026-10-07T11:40:00Z",
      "status": "pending",
      "feedback": [],
      "answered_by": null,
      "url": "https://github.com/moooncang/game/issues/5#issuecomment-2000000007"
    },
    {
      "id": 2000000006,
      "doc": "5-4",
      "task": 5,
      "author": "claude",
      "branch": "검수",
      "kind": "검수결과",
      "title": "PR #9 검수: 색감·연출 확인",
      "pr": 9,
      "answers": [],
      "body_md": "## 검수 결과\n- 테스트 통과\n- 바닥 대비가 강해 글자가 묻히는 곳 1군데",
      "created_at": "2026-10-07T10:15:00Z",
      "status": "pending",
      "feedback": [],
      "answered_by": null,
      "url": "https://github.com/moooncang/game/issues/5#issuecomment-2000000006"
    },
    {
      "id": 2000000005,
      "doc": "5-3",
      "task": 5,
      "author": "gpt",
      "branch": "연출",
      "kind": "작업보고",
      "title": "서류 제출 시 +1 숫자 연출 추가",
      "pr": 9,
      "answers": [],
      "body_md": "## 한 일\n- 서류함 위로 📄 +1 이 떠오름",
      "created_at": "2026-10-07T10:00:00Z",
      "status": "approved",
      "feedback": [
        {
          "type": "approve",
          "body_md": "",
          "at": "2026-10-07T11:00:00Z",
          "closed": true,
          "resolved_by": null,
          "url": "https://github.com/moooncang/game/issues/5#issuecomment-3000000003"
        }
      ],
      "answered_by": null,
      "url": "https://github.com/moooncang/game/issues/5#issuecomment-2000000005"
    },
    {
      "id": 2000000004,
      "doc": "5-2",
      "task": 5,
      "author": "gpt",
      "branch": "색감",
      "kind": "작업보고",
      "title": "진한 나무 바닥 + 크림 벽 팔레트 적용",
      "pr": 9,
      "answers": [],
      "body_md": "## 한 일\n- 바닥 #7a583d, 벽 #eae9db\n- 가구 외곽선 #241e20",
      "created_at": "2026-10-07T09:55:00Z",
      "status": "feedback",
      "feedback": [
        {
          "type": "feedback",
          "body_md": "바닥이 너무 어두워요. 한 단계 밝게 해 주세요.",
          "at": "2026-10-07T11:02:00Z",
          "closed": false,
          "resolved_by": null,
          "url": "https://github.com/moooncang/game/issues/5#issuecomment-3000000004"
        }
      ],
      "answered_by": null,
      "url": "https://github.com/moooncang/game/issues/5#issuecomment-2000000004"
    },
    {
      "id": 2000000003,
      "doc": "5-1",
      "task": 5,
      "author": "gpt",
      "branch": "화면 구성",
      "kind": "작업보고",
      "title": "3/4 시점 가구와 소품 추가",
      "pr": 9,
      "answers": [],
      "body_md": "## 한 일\n- 자판기, 책장, 화이트보드 추가\n- 책상 앞면·윗면 분리",
      "created_at": "2026-10-07T09:50:00Z",
      "status": "answered",
      "feedback": [
        {
          "type": "reject",
          "body_md": "책장이 출구를 막아요.",
          "at": "2026-10-07T10:30:00Z",
          "closed": true,
          "resolved_by": "5-5",
          "url": "https://github.com/moooncang/game/issues/5#issuecomment-3000000002"
        }
      ],
      "answered_by": "5-5",
      "url": "https://github.com/moooncang/game/issues/5#issuecomment-2000000003"
    }
  ]
}
